Hitchhikers_Guide_to_the_Galaxy_EN_batch_02_item_17	Hitchhikers_Guide_to_the_Galaxy_EN_paragraph_20	novel	NA	English	NA	NA	10	0.6	synchronous:0; precedence:0.6; succession:0.1; reason:0; result:0; arg1-as-cond:0; arg2-as-cond:0; arg1-as-negcond:0; arg2-as-negcond:0; arg1-as-goal:0; arg2-as-goal:0; arg1-as-denier:0; arg2-as-denier:0; contrast:0.1; similarity:0; conjunction:0; disjunction:0; arg1-as-instance:0.1; arg2-as-instance:0; arg1-as-detail:0; arg2-as-detail:0; equivalence:0; arg1-as-manner:0.1; arg2-as-manner:0; arg1-as-excpt:0; arg2-as-excpt:0; arg2-as-subst:0; arg1-as-subst:0; differentcon:0; norel:0	precedence	precedence	precedence	It said: \"There's no point in acting all surprised about it. All the planning charts and demolition orders have been on display in your local planning department on Alpha Centauri for fifty of your Earth years, so you've had plenty of time to lodge any formal complaint and it's far too late to start making a fuss about it now.\"	The PA fell silent again and its echo drifted off across the land. The huge ships turned slowly in the sky with easy power.	\"All the planning charts and demolition orders have been on display in your local planning department on Alpha Centauri for fifty of your Earth years, so you've had plenty of time to lodge any formal complaint and it's far too late to start making a fuss about it now.\"\"\"	The PA fell silent again and its echo drifted off across the land.
Hitchhikers_Guide_to_the_Galaxy_EN_batch_02_item_18	Hitchhikers_Guide_to_the_Galaxy_EN_paragraph_21	novel	NA	English	NA	NA	10	0.4	synchronous:0; precedence:0; succession:0; reason:0; result:0; arg1-as-cond:0; arg2-as-cond:0; arg1-as-negcond:0; arg2-as-negcond:0; arg1-as-goal:0; arg2-as-goal:0; arg1-as-denier:0.1; arg2-as-denier:0.2; contrast:0.4; similarity:0; conjunction:0.2; disjunction:0; arg1-as-instance:0; arg2-as-instance:0; arg1-as-detail:0; arg2-as-detail:0.1; equivalence:0; arg1-as-manner:0; arg2-as-manner:0; arg1-as-excpt:0; arg2-as-excpt:0; arg2-as-subst:0; arg1-as-subst:0; differentcon:0; norel:0	contrast	contrast;arg2-as-denier;conjunction	contrast	No one had gone bananas, not in that way at least. Only six people in the entire Galaxy understood the principle on which the Galaxy was governed, and they knew that once Zaphod Beeblebrox had announced his intention to run as President it was more or less a fait accompli: he was the ideal Presidency fodder.	What they completely failed to understand was why Zaphod was doing it. He banked sharply, shooting a wild wall of water at the sun.	Only six people in the entire Galaxy understood the principle on which the Galaxy was governed, and they knew that once Zaphod Beeblebrox had announced his intention to run as President it was more or less a fait accompli: he was the ideal Presidency fodder.	What they completely failed to understand was why Zaphod was doing it.
Hitchhikers_Guide_to_the_Galaxy_EN_batch_02_item_19	Hitchhikers_Guide_to_the_Galaxy_EN_paragraph_21	novel	NA	English	NA	NA	10	0.4	synchronous:0.4; precedence:0.2; succession:0; reason:0; result:0.1; arg1-as-cond:0; arg2-as-cond:0.1; arg1-as-negcond:0; arg2-as-negcond:0; arg1-as-goal:0; arg2-as-goal:0; arg1-as-denier:0; arg2-as-denier:0.1; contrast:0; similarity:0; conjunction:0; disjunction:0; arg1-as-instance:0; arg2-as-instance:0.1; arg1-as-detail:0; arg2-as-detail:0; equivalence:0; arg1-as-manner:0; arg2-as-manner:0; arg1-as-excpt:0; arg2-as-excpt:0; arg2-as-subst:0; arg1-as-subst:0; differentcon:0; norel:0	synchronous	synchronous;precedence	synchronous	Only six people in the entire Galaxy understood the principle on which the Galaxy was governed, and they knew that once Zaphod Beeblebrox had announced his intention to run as President it was more or less a fait accompli: he was the ideal Presidency fodder. What they completely failed to understand was why Zaphod was doing it.	He banked sharply, shooting a wild wall of water at the sun. Today was the day; today was the day when they would realize what Zaphod had been up to.	What they completely failed to understand was why Zaphod was doing it.	He banked sharply, shooting a wild wall of water at the sun.
Hitchhikers_Guide_to_the_Galaxy_EN_batch_02_item_20	Hitchhikers_Guide_to_the_Galaxy_EN_paragraph_21	novel	NA	English	NA	NA	11	0.2727272727	synchronous:0.09090909090909091; precedence:0.2727272727272727; succession:0; reason:0.09090909090909091; result:0.09090909090909091; arg1-as-cond:0; arg2-as-cond:0; arg1-as-negcond:0; arg2-as-negcond:0; arg1-as-goal:0; arg2-as-goal:0; arg1-as-denier:0; arg2-as-denier:0; contrast:0; similarity:0; conjunction:0.2727272727272727; disjunction:0; arg1-as-instance:0; arg2-as-instance:0; arg1-as-detail:0; arg2-as-detail:0.18181818181818182; equivalence:0; arg1-as-manner:0; arg2-as-manner:0; arg1-as-excpt:0; arg2-as-excpt:0; arg2-as-subst:0; arg1-as-subst:0; differentcon:0; norel:0	conjunction	precedence;conjunction	conjunction	What they completely failed to understand was why Zaphod was doing it. He banked sharply, shooting a wild wall of water at the sun.	Today was the day; today was the day when they would realize what Zaphod had been up to. Today was what Zaphod Beeblebrox's Presidency was all about.	He banked sharply, shooting a wild wall of water at the sun.	Today was the day; today was the day when they would realize what Zaphod had been up to.
Hitchhikers_Guide_to_the_Galaxy_EN_batch_03_item_01	Hitchhikers_Guide_to_the_Galaxy_EN_paragraph_21	novel	NA	English	NA	NA	10	0.4	synchronous:0; precedence:0; succession:0; reason:0; result:0.3; arg1-as-cond:0; arg2-as-cond:0; arg1-as-negcond:0; arg2-as-negcond:0; arg1-as-goal:0; arg2-as-goal:0; arg1-as-denier:0; arg2-as-denier:0; contrast:0; similarity:0; conjunction:0.4; disjunction:0; arg1-as-instance:0; arg2-as-instance:0; arg1-as-detail:0.1; arg2-as-detail:0.1; equivalence:0.1; arg1-as-manner:0; arg2-as-manner:0; arg1-as-excpt:0; arg2-as-excpt:0; arg2-as-subst:0; arg1-as-subst:0; differentcon:0; norel:0	conjunction	conjunction;result	conjunction	He banked sharply, shooting a wild wall of water at the sun. Today was the day; today was the day when they would realize what Zaphod had been up to.	Today was what Zaphod Beeblebrox's Presidency was all about. Today was also his two hundredth birthday, but that was just another meaningless coincidence.	Today was the day; today was the day when they would realize what Zaphod had been up to.	Today was what Zaphod Beeblebrox's Presidency was all about.
Hitchhikers_Guide_to_the_Galaxy_EN_batch_03_item_02	Hitchhikers_Guide_to_the_Galaxy_EN_paragraph_22	novel	NA	English	NA	NA	10	0.6	synchronous:0; precedence:0; succession:0; reason:0.1; result:0; arg1-as-cond:0; arg2-as-cond:0; arg1-as-negcond:0; arg2-as-negcond:0; arg1-as-goal:0; arg2-as-goal:0; arg1-as-denier:0; arg2-as-denier:0; contrast:0; similarity:0; conjunction:0.3; disjunction:0; arg1-as-instance:0; arg2-as-instance:0; arg1-as-detail:0; arg2-as-detail:0.6; equivalence:0; arg1-as-manner:0; arg2-as-manner:0; arg1-as-excpt:0; arg2-as-excpt:0; arg2-as-subst:0; arg1-as-subst:0; differentcon:0; norel:0	arg2-as-detail	arg2-as-detail;conjunction	arg2-as-detail	But his nerves sang a song shriller than a dog whistle.  The island of France was about twenty miles long, five miles across the middle, sandy and crescent shaped. In fact it seemed to exist not so much as an island in its own right as simply a means of defining the sweep and curve of a huge bay.	This impression was heightened by the fact that the inner coastline of the crescent consisted almost entirely of steep cliffs. From the top of the cliff the land sloped slowly down five miles to the opposite shore.	In fact it seemed to exist not so much as an island in its own right as simply a means of defining the sweep and curve of a huge bay.	This impression was heightened by the fact that the inner coastline of the crescent consisted almost entirely of steep cliffs.
Hitchhikers_Guide_to_the_Galaxy_EN_batch_03_item_03	Hitchhikers_Guide_to_the_Galaxy_EN_paragraph_22	novel	NA	English	NA	NA	10	0.5	synchronous:0; precedence:0; succession:0; reason:0; result:0; arg1-as-cond:0; arg2-as-cond:0; arg1-as-negcond:0; arg2-as-negcond:0; arg1-as-goal:0; arg2-as-goal:0; arg1-as-denier:0; arg2-as-denier:0; contrast:0; similarity:0.1; conjunction:0.5; disjunction:0; arg1-as-instance:0; arg2-as-instance:0; arg1-as-detail:0; arg2-as-detail:0.4; equivalence:0; arg1-as-manner:0; arg2-as-manner:0; arg1-as-excpt:0; arg2-as-excpt:0; arg2-as-subst:0; arg1-as-subst:0; differentcon:0; norel:0	conjunction	arg2-as-detail;conjunction	arg2-as-detail;conjunction	In fact it seemed to exist not so much as an island in its own right as simply a means of defining the sweep and curve of a huge bay. This impression was heightened by the fact that the inner coastline of the crescent consisted almost entirely of steep cliffs.	From the top of the cliff the land sloped slowly down five miles to the opposite shore. On top of the cliffs stood a reception committee.	This impression was heightened by the fact that the inner coastline of the crescent consisted almost entirely of steep cliffs.	From the top of the cliff the land sloped slowly down five miles to the opposite shore.
Hitchhikers_Guide_to_the_Galaxy_EN_batch_03_item_04	Hitchhikers_Guide_to_the_Galaxy_EN_paragraph_22	novel	NA	English	NA	NA	10	0.3	synchronous:0.1; precedence:0; succession:0; reason:0; result:0; arg1-as-cond:0; arg2-as-cond:0; arg1-as-negcond:0; arg2-as-negcond:0; arg1-as-goal:0; arg2-as-goal:0; arg1-as-denier:0; arg2-as-denier:0; contrast:0.3; similarity:0.1; conjunction:0.2; disjunction:0; arg1-as-instance:0; arg2-as-instance:0; arg1-as-detail:0; arg2-as-detail:0.3; equivalence:0; arg1-as-manner:0; arg2-as-manner:0; arg1-as-excpt:0; arg2-as-excpt:0; arg2-as-subst:0; arg1-as-subst:0; differentcon:0; norel:0	arg2-as-detail	arg2-as-detail;contrast;conjunction	arg2-as-detail	This impression was heightened by the fact that the inner coastline of the crescent consisted almost entirely of steep cliffs. From the top of the cliff the land sloped slowly down five miles to the opposite shore.	On top of the cliffs stood a reception committee. It consisted in large part of the engineers and researchers who had built the Heart of Gold - mostly humanoid, but here and there were a few reptiloid atomineers, two or three green slyph-like maximegalacticans, an octopoid physucturalist or two and a Hooloovoo (a Hooloovoo is a super-intelligent shade of the color blue).  All except the Hooloovoo were resplendent in their multicolored ceremonial lab coats; the Hooloovoo had been temporarily refracted into a free standing prism for the occasion.	From the top of the cliff the land sloped slowly down five miles to the opposite shore.	On top of the cliffs stood a reception committee.
Hitchhikers_Guide_to_the_Galaxy_EN_batch_03_item_05	Hitchhikers_Guide_to_the_Galaxy_EN_paragraph_22	novel	NA	English	NA	NA	10	0.4	synchronous:0; precedence:0; succession:0; reason:0.1; result:0; arg1-as-cond:0; arg2-as-cond:0; arg1-as-negcond:0; arg2-as-negcond:0; arg1-as-goal:0; arg2-as-goal:0; arg1-as-denier:0.1; arg2-as-denier:0; contrast:0; similarity:0; conjunction:0.4; disjunction:0; arg1-as-instance:0; arg2-as-instance:0.1; arg1-as-detail:0; arg2-as-detail:0.3; equivalence:0; arg1-as-manner:0; arg2-as-manner:0; arg1-as-excpt:0; arg2-as-excpt:0; arg2-as-subst:0; arg1-as-subst:0; differentcon:0; norel:0	conjunction	arg2-as-detail;conjunction	conjunction	Together and between them they had gone to and beyond the furthest limits of physical laws, restructured the fundamental fabric of matter, strained, twisted and broken the laws of possibility and impossibility, but still the greatest excitement of all seemed to be to meet a man with an orange sash round his neck.  (An orange sash was what the President of the Galaxy traditionally wore.) It might not even have made much difference to them if they'd known exactly how much power the President of the Galaxy actually wielded: none at all.	Only six people in the Galaxy knew that the job of the Galactic President was not to wield power but to attract attention away from it. Zaphod Beeblebrox was amazingly good at his job.	It might not even have made much difference to them if they'd known exactly how much power the President of the Galaxy actually wielded: none at all.	Only six people in the Galaxy knew that the job of the Galactic President was not to wield power but to attract attention away from it.
Hitchhikers_Guide_to_the_Galaxy_EN_batch_03_item_06	Hitchhikers_Guide_to_the_Galaxy_EN_paragraph_22	novel	NA	English	NA	NA	10	0.3	synchronous:0; precedence:0; succession:0; reason:0.1; result:0.3; arg1-as-cond:0; arg2-as-cond:0; arg1-as-negcond:0; arg2-as-negcond:0; arg1-as-goal:0; arg2-as-goal:0; arg1-as-denier:0; arg2-as-denier:0; contrast:0.2; similarity:0; conjunction:0.1; disjunction:0; arg1-as-instance:0.1; arg2-as-instance:0; arg1-as-detail:0; arg2-as-detail:0.2; equivalence:0; arg1-as-manner:0; arg2-as-manner:0; arg1-as-excpt:0; arg2-as-excpt:0; arg2-as-subst:0; arg1-as-subst:0; differentcon:0; norel:0	result	arg2-as-detail;result;contrast	result	It might not even have made much difference to them if they'd known exactly how much power the President of the Galaxy actually wielded: none at all. Only six people in the Galaxy knew that the job of the Galactic President was not to wield power but to attract attention away from it.	Zaphod Beeblebrox was amazingly good at his job. The crowd gasped, dazzled by sun and seemanship, as the Presidential speedboat zipped round the headland into the bay.	Only six people in the Galaxy knew that the job of the Galactic President was not to wield power but to attract attention away from it.	Zaphod Beeblebrox was amazingly good at his job.
Hitchhikers_Guide_to_the_Galaxy_EN_batch_03_item_07	Hitchhikers_Guide_to_the_Galaxy_EN_paragraph_22	novel	NA	English	NA	NA	10	0.4	synchronous:0.1; precedence:0; succession:0; reason:0; result:0.2; arg1-as-cond:0; arg2-as-cond:0; arg1-as-negcond:0; arg2-as-negcond:0; arg1-as-goal:0; arg2-as-goal:0; arg1-as-denier:0; arg2-as-denier:0; contrast:0; similarity:0; conjunction:0.1; disjunction:0; arg1-as-instance:0; arg2-as-instance:0.4; arg1-as-detail:0.1; arg2-as-detail:0; equivalence:0; arg1-as-manner:0; arg2-as-manner:0.1; arg1-as-excpt:0; arg2-as-excpt:0; arg2-as-subst:0; arg1-as-subst:0; differentcon:0; norel:0	arg2-as-instance	arg2-as-instance;result	arg2-as-instance	Only six people in the Galaxy knew that the job of the Galactic President was not to wield power but to attract attention away from it. Zaphod Beeblebrox was amazingly good at his job.	The crowd gasped, dazzled by sun and seemanship, as the Presidential speedboat zipped round the headland into the bay. It flashed and shone as it came skating over the sea in wide skidding turns.  In fact it didn't need to touch the water at all, because it was supported on a hazy cushion of ionized atoms - but just for effect it was fitted with thin finblades which could be lowered into the water.	Zaphod Beeblebrox was amazingly good at his job.	The crowd gasped, dazzled by sun and seemanship, as the Presidential speedboat zipped round the headland into the bay.
Hitchhikers_Guide_to_the_Galaxy_EN_batch_03_item_08	Hitchhikers_Guide_to_the_Galaxy_EN_paragraph_22	novel	NA	English	NA	NA	10	0.3	synchronous:0; precedence:0.1; succession:0; reason:0; result:0.3; arg1-as-cond:0; arg2-as-cond:0; arg1-as-negcond:0; arg2-as-negcond:0; arg1-as-goal:0; arg2-as-goal:0.1; arg1-as-denier:0; arg2-as-denier:0; contrast:0; similarity:0; conjunction:0.2; disjunction:0; arg1-as-instance:0; arg2-as-instance:0; arg1-as-detail:0; arg2-as-detail:0.3; equivalence:0; arg1-as-manner:0; arg2-as-manner:0; arg1-as-excpt:0; arg2-as-excpt:0; arg2-as-subst:0; arg1-as-subst:0; differentcon:0; norel:0	result	result;conjunction;arg2-as-detail	result	It flashed and shone as it came skating over the sea in wide skidding turns. In fact it didn't need to touch the water at all, because it was supported on a hazy cushion of ionized atoms - but just for effect it was fitted with thin finblades which could be lowered into the water.	They slashed sheets of water hissing into the air, carved deep gashes into the sea which swayed crazily and sank back foaming into the boat's wake as it careered across the bay. Zaphod loved effect: it was what he was best at.	In fact it didn't need to touch the water at all, because it was supported on a hazy cushion of ionized atoms - but just for effect it was fitted with thin finblades which could be lowered into the water.	They slashed sheets of water hissing into the air, carved deep gashes into the sea which swayed crazily and sank back foaming into the boat's wake as it careered across the bay.
Hitchhikers_Guide_to_the_Galaxy_EN_batch_03_item_09	Hitchhikers_Guide_to_the_Galaxy_EN_paragraph_22	novel	NA	English	NA	NA	10	0.4	synchronous:0; precedence:0; succession:0; reason:0.2; result:0.4; arg1-as-cond:0; arg2-as-cond:0; arg1-as-negcond:0; arg2-as-negcond:0; arg1-as-goal:0; arg2-as-goal:0; arg1-as-denier:0; arg2-as-denier:0; contrast:0; similarity:0; conjunction:0; disjunction:0; arg1-as-instance:0.3; arg2-as-instance:0; arg1-as-detail:0.1; arg2-as-detail:0; equivalence:0; arg1-as-manner:0; arg2-as-manner:0; arg1-as-excpt:0; arg2-as-excpt:0; arg2-as-subst:0; arg1-as-subst:0; differentcon:0; norel:0	result	reason;result;arg1-as-instance	result	In fact it didn't need to touch the water at all, because it was supported on a hazy cushion of ionized atoms - but just for effect it was fitted with thin finblades which could be lowered into the water. They slashed sheets of water hissing into the air, carved deep gashes into the sea which swayed crazily and sank back foaming into the boat's wake as it careered across the bay.	Zaphod loved effect: it was what he was best at. He twisted the wheel sharply, the boat slewed round in a wild scything skid beneath the cliff face and dropped to rest lightly on the rocking waves.	They slashed sheets of water hissing into the air, carved deep gashes into the sea which swayed crazily and sank back foaming into the boat's wake as it careered across the bay.	Zaphod loved effect: it was what he was best at.
Hitchhikers_Guide_to_the_Galaxy_EN_batch_03_item_10	Hitchhikers_Guide_to_the_Galaxy_EN_paragraph_22	novel	NA	English	NA	NA	10	0.6	synchronous:0.1; precedence:0.1; succession:0.1; reason:0; result:0; arg1-as-cond:0; arg2-as-cond:0; arg1-as-negcond:0; arg2-as-negcond:0; arg1-as-goal:0; arg2-as-goal:0; arg1-as-denier:0; arg2-as-denier:0; contrast:0; similarity:0; conjunction:0.1; disjunction:0; arg1-as-instance:0; arg2-as-instance:0.6; arg1-as-detail:0; arg2-as-detail:0; equivalence:0; arg1-as-manner:0; arg2-as-manner:0; arg1-as-excpt:0; arg2-as-excpt:0; arg2-as-subst:0; arg1-as-subst:0; differentcon:0; norel:0	arg2-as-instance	arg2-as-instance	arg2-as-instance	They slashed sheets of water hissing into the air, carved deep gashes into the sea which swayed crazily and sank back foaming into the boat's wake as it careered across the bay. Zaphod loved effect: it was what he was best at.	He twisted the wheel sharply, the boat slewed round in a wild scything skid beneath the cliff face and dropped to rest lightly on the rocking waves. Within seconds he ran out onto the deck and waved and grinned at over three billion people.	Zaphod loved effect: it was what he was best at.	He twisted the wheel sharply, the boat slewed round in a wild scything skid beneath the cliff face and dropped to rest lightly on the rocking waves.
Hitchhikers_Guide_to_the_Galaxy_EN_batch_03_item_11	Hitchhikers_Guide_to_the_Galaxy_EN_paragraph_22	novel	NA	English	NA	NA	10	0.3	synchronous:0; precedence:0.1; succession:0; reason:0; result:0; arg1-as-cond:0; arg2-as-cond:0; arg1-as-negcond:0; arg2-as-negcond:0; arg1-as-goal:0; arg2-as-goal:0; arg1-as-denier:0.1; arg2-as-denier:0.2; contrast:0.1; similarity:0; conjunction:0.2; disjunction:0; arg1-as-instance:0; arg2-as-instance:0; arg1-as-detail:0; arg2-as-detail:0.3; equivalence:0; arg1-as-manner:0; arg2-as-manner:0; arg1-as-excpt:0; arg2-as-excpt:0; arg2-as-subst:0; arg1-as-subst:0; differentcon:0; norel:0	arg2-as-detail	arg2-as-detail;arg2-as-denier;conjunction	arg2-as-detail	He twisted the wheel sharply, the boat slewed round in a wild scything skid beneath the cliff face and dropped to rest lightly on the rocking waves. Within seconds he ran out onto the deck and waved and grinned at over three billion people.	The three billion people weren't actually there, but they watched his every gesture through the eyes of a small robot tri-D camera which hovered obsequiously in the air nearby. The antics of the President always made amazingly popular tri-D; that's what they were for.	Within seconds he ran out onto the deck and waved and grinned at over three billion people.	The three billion people weren't actually there, but they watched his every gesture through the eyes of a small robot tri-D camera which hovered obsequiously in the air nearby.
Hitchhikers_Guide_to_the_Galaxy_EN_batch_03_item_12	Hitchhikers_Guide_to_the_Galaxy_EN_paragraph_22	novel	NA	English	NA	NA	10	0.2	synchronous:0; precedence:0; succession:0; reason:0.2; result:0.2; arg1-as-cond:0; arg2-as-cond:0; arg1-as-negcond:0; arg2-as-negcond:0; arg1-as-goal:0; arg2-as-goal:0.1; arg1-as-denier:0; arg2-as-denier:0; contrast:0.1; similarity:0; conjunction:0.2; disjunction:0; arg1-as-instance:0; arg2-as-instance:0; arg1-as-detail:0.1; arg2-as-detail:0.1; equivalence:0; arg1-as-manner:0; arg2-as-manner:0; arg1-as-excpt:0; arg2-as-excpt:0; arg2-as-subst:0; arg1-as-subst:0; differentcon:0; norel:0	result	reason;result;conjunction	result	Within seconds he ran out onto the deck and waved and grinned at over three billion people. The three billion people weren't actually there, but they watched his every gesture through the eyes of a small robot tri-D camera which hovered obsequiously in the air nearby.	The antics of the President always made amazingly popular tri-D; that's what they were for. He grinned again.  Three billion and six people didn't know it, but today would be a bigger antic than anyone had bargained for.	The three billion people weren't actually there, but they watched his every gesture through the eyes of a small robot tri-D camera which hovered obsequiously in the air nearby.	The antics of the President always made amazingly popular tri-D; that's what they were for.
Hitchhikers_Guide_to_the_Galaxy_EN_batch_03_item_13	Hitchhikers_Guide_to_the_Galaxy_EN_paragraph_23	novel	NA	English	NA	NA	10	0.4	synchronous:0; precedence:0; succession:0.1; reason:0; result:0.4; arg1-as-cond:0; arg2-as-cond:0; arg1-as-negcond:0; arg2-as-negcond:0; arg1-as-goal:0.1; arg2-as-goal:0; arg1-as-denier:0.1; arg2-as-denier:0; contrast:0.1; similarity:0; conjunction:0.1; disjunction:0; arg1-as-instance:0; arg2-as-instance:0; arg1-as-detail:0.1; arg2-as-detail:0; equivalence:0; arg1-as-manner:0; arg2-as-manner:0; arg1-as-excpt:0; arg2-as-excpt:0; arg2-as-subst:0; arg1-as-subst:0; differentcon:0; norel:0	result	result	result	Inside it floated a wide semi-circular sofa upholstered in glorious red leather: the more the globe bobbed and rolled, the more the sofa stayed perfectly still, steady as an upholstered rock. Again, all done for effect as much as anything.	Zaphod stepped through the wall of the globe and relaxed on the sofa. He spread his two arms lazily along the back and with the third brushed some dust off his knee.	Again, all done for effect as much as anything.	Zaphod stepped through the wall of the globe and relaxed on the sofa.
Hitchhikers_Guide_to_the_Galaxy_EN_batch_03_item_14	Hitchhikers_Guide_to_the_Galaxy_EN_paragraph_23	novel	NA	English	NA	NA	10	0.4	synchronous:0; precedence:0.4; succession:0.2; reason:0; result:0; arg1-as-cond:0; arg2-as-cond:0; arg1-as-negcond:0; arg2-as-negcond:0; arg1-as-goal:0; arg2-as-goal:0; arg1-as-denier:0; arg2-as-denier:0; contrast:0; similarity:0; conjunction:0.1; disjunction:0; arg1-as-instance:0; arg2-as-instance:0; arg1-as-detail:0; arg2-as-detail:0.3; equivalence:0; arg1-as-manner:0; arg2-as-manner:0; arg1-as-excpt:0; arg2-as-excpt:0; arg2-as-subst:0; arg1-as-subst:0; differentcon:0; norel:0	precedence	succession;precedence;arg2-as-detail	precedence	Again, all done for effect as much as anything. Zaphod stepped through the wall of the globe and relaxed on the sofa.	He spread his two arms lazily along the back and with the third brushed some dust off his knee. His heads looked about, smiling; he put his feet up.	Zaphod stepped through the wall of the globe and relaxed on the sofa.	He spread his two arms lazily along the back and with the third brushed some dust off his knee.
Hitchhikers_Guide_to_the_Galaxy_EN_batch_03_item_15	Hitchhikers_Guide_to_the_Galaxy_EN_paragraph_23	novel	NA	English	NA	NA	10	0.5	synchronous:0.1; precedence:0.5; succession:0; reason:0; result:0; arg1-as-cond:0; arg2-as-cond:0; arg1-as-negcond:0; arg2-as-negcond:0; arg1-as-goal:0; arg2-as-goal:0; arg1-as-denier:0; arg2-as-denier:0; contrast:0; similarity:0; conjunction:0.3; disjunction:0; arg1-as-instance:0; arg2-as-instance:0; arg1-as-detail:0; arg2-as-detail:0.1; equivalence:0; arg1-as-manner:0; arg2-as-manner:0; arg1-as-excpt:0; arg2-as-excpt:0; arg2-as-subst:0; arg1-as-subst:0; differentcon:0; norel:0	precedence	precedence;conjunction	precedence	Zaphod stepped through the wall of the globe and relaxed on the sofa. He spread his two arms lazily along the back and with the third brushed some dust off his knee.	His heads looked about, smiling; he put his feet up. At any moment, he thought, he might scream.  Water boiled up beneath the bubble, it seethed and spouted.	He spread his two arms lazily along the back and with the third brushed some dust off his knee.	His heads looked about, smiling; he put his feet up.
