itemid	datasource	genre	subgenre	orig_lang	speaker_id	reflabel	observations	maxagree	majority_softlabel	majoritylabel_sampled	majority_distrlabel20	majority_distrlabel40	arg1	arg2	sent1	sent2
Animal_Farm_EN_batch_01_item_01	Animal_Farm_EN_paragraph_01	novel	NA	English	NA	NA	10	0.3	synchronous:0; precedence:0; succession:0; reason:0; result:0.2; arg1-as-cond:0; arg2-as-cond:0; arg1-as-negcond:0; arg2-as-negcond:0; arg1-as-goal:0.2; arg2-as-goal:0; arg1-as-denier:0; arg2-as-denier:0; contrast:0; similarity:0; conjunction:0.3; disjunction:0; arg1-as-instance:0; arg2-as-instance:0.1; arg1-as-detail:0.1; arg2-as-detail:0.1; equivalence:0; arg1-as-manner:0; arg2-as-manner:0; arg1-as-excpt:0; arg2-as-excpt:0; arg2-as-subst:0; arg1-as-subst:0; differentcon:0; norel:0	conjunction	conjunction;arg1-as-goal;result	conjunction	It had been agreed that they should all meet in the big barn as soon as Mr. Jones was safely out of the way. Old Major (so he was always called, though the name under which he had been exhibited was Willingdon Beauty) was so highly regarded on the farm that everyone was quite ready to lose an hour's sleep in order to hear what he had to say.	At one end of the big barn, on a sort of raised platform, Major was already ensconced on his bed of straw, under a lantern which hung from a beam. He was twelve years old and had lately grown rather stout, but he was still a majestic-looking pig, with a wise and benevolent appearance in spite of the fact that his tushes had never been cut.	Old Major (so he was always called, though the name under which he had been exhibited was Willingdon Beauty) was so highly regarded on the farm that everyone was quite ready to lose an hour's sleep in order to hear what he had to say.	At one end of the big barn, on a sort of raised platform, Major was already ensconced on his bed of straw, under a lantern which hung from a beam.
Animal_Farm_EN_batch_01_item_02	Animal_Farm_EN_paragraph_01	novel	NA	English	NA	NA	10	0.9	synchronous:0; precedence:0; succession:0; reason:0; result:0; arg1-as-cond:0; arg2-as-cond:0; arg1-as-negcond:0; arg2-as-negcond:0; arg1-as-goal:0; arg2-as-goal:0; arg1-as-denier:0; arg2-as-denier:0; contrast:0; similarity:0; conjunction:0.1; disjunction:0; arg1-as-instance:0; arg2-as-instance:0; arg1-as-detail:0; arg2-as-detail:0.9; equivalence:0; arg1-as-manner:0; arg2-as-manner:0; arg1-as-excpt:0; arg2-as-excpt:0; arg2-as-subst:0; arg1-as-subst:0; differentcon:0; norel:0	arg2-as-detail	arg2-as-detail	arg2-as-detail	Old Major (so he was always called, though the name under which he had been exhibited was Willingdon Beauty) was so highly regarded on the farm that everyone was quite ready to lose an hour's sleep in order to hear what he had to say. At one end of the big barn, on a sort of raised platform, Major was already ensconced on his bed of straw, under a lantern which hung from a beam.	He was twelve years old and had lately grown rather stout, but he was still a majestic-looking pig, with a wise and benevolent appearance in spite of the fact that his tushes had never been cut. Before long the other animals began to arrive and make themselves comfortable after their different fashions.  First came the three dogs, Bluebell, Jessie, and Pincher, and then the pigs, who settled down in the straw immediately in front of the platform.	At one end of the big barn, on a sort of raised platform, Major was already ensconced on his bed of straw, under a lantern which hung from a beam.	He was twelve years old and had lately grown rather stout, but he was still a majestic-looking pig, with a wise and benevolent appearance in spite of the fact that his tushes had never been cut.
Animal_Farm_EN_batch_01_item_03	Animal_Farm_EN_paragraph_01	novel	NA	English	NA	NA	10	0.4	synchronous:0; precedence:0.4; succession:0.3; reason:0; result:0; arg1-as-cond:0; arg2-as-cond:0; arg1-as-negcond:0; arg2-as-negcond:0; arg1-as-goal:0; arg2-as-goal:0; arg1-as-denier:0; arg2-as-denier:0; contrast:0; similarity:0; conjunction:0.2; disjunction:0; arg1-as-instance:0; arg2-as-instance:0; arg1-as-detail:0; arg2-as-detail:0; equivalence:0; arg1-as-manner:0; arg2-as-manner:0.1; arg1-as-excpt:0; arg2-as-excpt:0; arg2-as-subst:0; arg1-as-subst:0; differentcon:0; norel:0	precedence	succession;precedence;conjunction	precedence	Before long the other animals began to arrive and make themselves comfortable after their different fashions. First came the three dogs, Bluebell, Jessie, and Pincher, and then the pigs, who settled down in the straw immediately in front of the platform.	The hens perched themselves on the window-sills, the pigeons fluttered up to the rafters, the sheep and cows lay down behind the pigs and began to chew the cud. The two cart-horses, Boxer and Clover, came in together, walking very slowly and setting down their vast hairy hoofs with great care lest there should be some small animal concealed in the straw.	First came the three dogs, Bluebell, Jessie, and Pincher, and then the pigs, who settled down in the straw immediately in front of the platform.	The hens perched themselves on the window-sills, the pigeons fluttered up to the rafters, the sheep and cows lay down behind the pigs and began to chew the cud.
Animal_Farm_EN_batch_01_item_04	Animal_Farm_EN_paragraph_01	novel	NA	English	NA	NA	10	0.7	synchronous:0; precedence:0; succession:0; reason:0; result:0; arg1-as-cond:0; arg2-as-cond:0; arg1-as-negcond:0; arg2-as-negcond:0; arg1-as-goal:0; arg2-as-goal:0; arg1-as-denier:0; arg2-as-denier:0; contrast:0; similarity:0; conjunction:0.3; disjunction:0; arg1-as-instance:0; arg2-as-instance:0; arg1-as-detail:0; arg2-as-detail:0.7; equivalence:0; arg1-as-manner:0; arg2-as-manner:0; arg1-as-excpt:0; arg2-as-excpt:0; arg2-as-subst:0; arg1-as-subst:0; differentcon:0; norel:0	arg2-as-detail	conjunction;arg2-as-detail	arg2-as-detail	The hens perched themselves on the window-sills, the pigeons fluttered up to the rafters, the sheep and cows lay down behind the pigs and began to chew the cud. The two cart-horses, Boxer and Clover, came in together, walking very slowly and setting down their vast hairy hoofs with great care lest there should be some small animal concealed in the straw.	Clover was a stout motherly mare approaching middle life, who had never quite got her figure back after her fourth foal. Boxer was an enormous beast, nearly eighteen hands high, and as strong as any two ordinary horses put together.	The two cart-horses, Boxer and Clover, came in together, walking very slowly and setting down their vast hairy hoofs with great care lest there should be some small animal concealed in the straw.	Clover was a stout motherly mare approaching middle life, who had never quite got her figure back after her fourth foal.
Animal_Farm_EN_batch_01_item_05	Animal_Farm_EN_paragraph_01	novel	NA	English	NA	NA	10	0.8	synchronous:0; precedence:0; succession:0; reason:0; result:0; arg1-as-cond:0; arg2-as-cond:0; arg1-as-negcond:0; arg2-as-negcond:0; arg1-as-goal:0; arg2-as-goal:0; arg1-as-denier:0; arg2-as-denier:0; contrast:0; similarity:0; conjunction:0.2; disjunction:0; arg1-as-instance:0; arg2-as-instance:0; arg1-as-detail:0; arg2-as-detail:0.8; equivalence:0; arg1-as-manner:0; arg2-as-manner:0; arg1-as-excpt:0; arg2-as-excpt:0; arg2-as-subst:0; arg1-as-subst:0; differentcon:0; norel:0	arg2-as-detail	arg2-as-detail;conjunction	arg2-as-detail	Clover was a stout motherly mare approaching middle life, who had never quite got her figure back after her fourth foal. Boxer was an enormous beast, nearly eighteen hands high, and as strong as any two ordinary horses put together.	A white stripe down his nose gave him a somewhat stupid appearance, and in fact he was not of first-rate intelligence, but he was universally respected for his steadiness of character and tremendous powers of work. After the horses came Muriel, the white goat, and Benjamin, the donkey.	Boxer was an enormous beast, nearly eighteen hands high, and as strong as any two ordinary horses put together.	A white stripe down his nose gave him a somewhat stupid appearance, and in fact he was not of first-rate intelligence, but he was universally respected for his steadiness of character and tremendous powers of work.
Animal_Farm_EN_batch_01_item_06	Animal_Farm_EN_paragraph_01	novel	NA	English	NA	NA	10	0.9	synchronous:0; precedence:0; succession:0; reason:0; result:0; arg1-as-cond:0; arg2-as-cond:0; arg1-as-negcond:0; arg2-as-negcond:0; arg1-as-goal:0; arg2-as-goal:0; arg1-as-denier:0; arg2-as-denier:0; contrast:0; similarity:0; conjunction:0.1; disjunction:0; arg1-as-instance:0; arg2-as-instance:0; arg1-as-detail:0; arg2-as-detail:0.9; equivalence:0; arg1-as-manner:0; arg2-as-manner:0; arg1-as-excpt:0; arg2-as-excpt:0; arg2-as-subst:0; arg1-as-subst:0; differentcon:0; norel:0	arg2-as-detail	arg2-as-detail	arg2-as-detail	A white stripe down his nose gave him a somewhat stupid appearance, and in fact he was not of first-rate intelligence, but he was universally respected for his steadiness of character and tremendous powers of work. After the horses came Muriel, the white goat, and Benjamin, the donkey.	Benjamin was the oldest animal on the farm, and the worst tempered. He seldom talked, and when he did, it was usually to make some cynical remark - for instance, he would say that God had given him a tail to keep the flies off, but that he would sooner have had no tail and no flies.	After the horses came Muriel, the white goat, and Benjamin, the donkey.	Benjamin was the oldest animal on the farm, and the worst tempered.
Animal_Farm_EN_batch_01_item_07	Animal_Farm_EN_paragraph_01	novel	NA	English	NA	NA	10	0.4	synchronous:0.1; precedence:0.4; succession:0.2; reason:0; result:0; arg1-as-cond:0; arg2-as-cond:0; arg1-as-negcond:0; arg2-as-negcond:0; arg1-as-goal:0; arg2-as-goal:0.1; arg1-as-denier:0; arg2-as-denier:0; contrast:0; similarity:0; conjunction:0; disjunction:0; arg1-as-instance:0; arg2-as-instance:0; arg1-as-detail:0; arg2-as-detail:0.1; equivalence:0; arg1-as-manner:0; arg2-as-manner:0.1; arg1-as-excpt:0; arg2-as-excpt:0; arg2-as-subst:0; arg1-as-subst:0; differentcon:0; norel:0	precedence	succession;precedence	precedence	Clover made a sort of wall round them with her great foreleg, and the ducklings nestled down inside it and promptly fell asleep. At the last moment Mollie, the foolish, pretty white mare who drew Mr. Jones's trap, came mincing daintily in, chewing at a lump of sugar.	She took a place near the front and began flirting her white mane, hoping to draw attention to the red ribbons it was plaited with. Last of all came the cat, who looked round, as usual, for the warmest place, and finally squeezed herself in between Boxer and Clover; there she purred contentedly throughout Major's speech without listening to a word of what he was saying.	At the last moment Mollie, the foolish, pretty white mare who drew Mr. Jones's trap, came mincing daintily in, chewing at a lump of sugar.	She took a place near the front and began flirting her white mane, hoping to draw attention to the red ribbons it was plaited with.
Animal_Farm_EN_batch_01_item_08	Animal_Farm_EN_paragraph_02	novel	NA	English	NA	NA	10	0.3	synchronous:0; precedence:0; succession:0; reason:0.2; result:0.3; arg1-as-cond:0; arg2-as-cond:0; arg1-as-negcond:0; arg2-as-negcond:0; arg1-as-goal:0; arg2-as-goal:0; arg1-as-denier:0.1; arg2-as-denier:0; contrast:0; similarity:0; conjunction:0.1; disjunction:0; arg1-as-instance:0.2; arg2-as-instance:0; arg1-as-detail:0.1; arg2-as-detail:0; equivalence:0; arg1-as-manner:0; arg2-as-manner:0; arg1-as-excpt:0; arg2-as-excpt:0; arg2-as-subst:0; arg1-as-subst:0; differentcon:0; norel:0	result	reason;result;arg1-as-instance	result	Why then do we continue in this miserable condition? Because nearly the whole of the produce of our labour is stolen from us by human beings.	There, comrades, is the answer to all our problems. It is summed up in a single word - Man.	Because nearly the whole of the produce of our labour is stolen from us by human beings.	There, comrades, is the answer to all our problems.
Animal_Farm_EN_batch_01_item_09	Animal_Farm_EN_paragraph_02	novel	NA	English	NA	NA	10	0.4	synchronous:0; precedence:0; succession:0; reason:0.2; result:0; arg1-as-cond:0; arg2-as-cond:0; arg1-as-negcond:0; arg2-as-negcond:0; arg1-as-goal:0; arg2-as-goal:0; arg1-as-denier:0; arg2-as-denier:0; contrast:0; similarity:0; conjunction:0.4; disjunction:0; arg1-as-instance:0; arg2-as-instance:0.1; arg1-as-detail:0; arg2-as-detail:0.1; equivalence:0.2; arg1-as-manner:0; arg2-as-manner:0; arg1-as-excpt:0; arg2-as-excpt:0; arg2-as-subst:0; arg1-as-subst:0; differentcon:0; norel:0	conjunction	equivalence;conjunction;reason	conjunction	Because nearly the whole of the produce of our labour is stolen from us by human beings. There, comrades, is the answer to all our problems.	It is summed up in a single word - Man. Man is the only real enemy we have.	There, comrades, is the answer to all our problems.	It is summed up in a single word - Man.
Animal_Farm_EN_batch_01_item_10	Animal_Farm_EN_paragraph_02	novel	NA	English	NA	NA	10	0.3	synchronous:0; precedence:0; succession:0; reason:0.3; result:0.2; arg1-as-cond:0; arg2-as-cond:0; arg1-as-negcond:0; arg2-as-negcond:0; arg1-as-goal:0; arg2-as-goal:0; arg1-as-denier:0; arg2-as-denier:0; contrast:0; similarity:0; conjunction:0.1; disjunction:0; arg1-as-instance:0; arg2-as-instance:0; arg1-as-detail:0.1; arg2-as-detail:0.3; equivalence:0; arg1-as-manner:0; arg2-as-manner:0; arg1-as-excpt:0; arg2-as-excpt:0; arg2-as-subst:0; arg1-as-subst:0; differentcon:0; norel:0	reason	result;arg2-as-detail;reason	reason	There, comrades, is the answer to all our problems. It is summed up in a single word - Man.	Man is the only real enemy we have. Remove Man from the scene, and the root cause of hunger and overwork is abolished for ever.	It is summed up in a single word - Man.	Man is the only real enemy we have.
Animal_Farm_EN_batch_01_item_11	Animal_Farm_EN_paragraph_03	novel	NA	English	NA	NA	10	0.7	synchronous:0; precedence:0.1; succession:0; reason:0; result:0.7; arg1-as-cond:0; arg2-as-cond:0; arg1-as-negcond:0; arg2-as-negcond:0; arg1-as-goal:0; arg2-as-goal:0.1; arg1-as-denier:0; arg2-as-denier:0; contrast:0; similarity:0; conjunction:0.1; disjunction:0; arg1-as-instance:0; arg2-as-instance:0; arg1-as-detail:0; arg2-as-detail:0; equivalence:0; arg1-as-manner:0; arg2-as-manner:0; arg1-as-excpt:0; arg2-as-excpt:0; arg2-as-subst:0; arg1-as-subst:0; differentcon:0; norel:0	result	result	result	As for the dogs, when they grow old and toothless, Jones ties a brick round their necks and drowns them in the nearest pond.  \"Is it not crystal clear, then, comrades, that all the evils of this life of ours spring from the tyranny of human beings? Only get rid of Man, and the produce of our labour would be our own.	Almost overnight we could become rich and free. What then must we do?  Why, work night and day, body and soul, for the overthrow of the human race!	Only get rid of Man, and the produce of our labour would be our own.	Almost overnight we could become rich and free.
Animal_Farm_EN_batch_01_item_12	Animal_Farm_EN_paragraph_03	novel	NA	English	NA	NA	10	0.3	synchronous:0; precedence:0; succession:0; reason:0; result:0.2; arg1-as-cond:0; arg2-as-cond:0; arg1-as-negcond:0; arg2-as-negcond:0; arg1-as-goal:0; arg2-as-goal:0.1; arg1-as-denier:0; arg2-as-denier:0; contrast:0; similarity:0; conjunction:0.2; disjunction:0; arg1-as-instance:0; arg2-as-instance:0; arg1-as-detail:0.3; arg2-as-detail:0; equivalence:0.1; arg1-as-manner:0; arg2-as-manner:0; arg1-as-excpt:0; arg2-as-excpt:0; arg2-as-subst:0.1; arg1-as-subst:0; differentcon:0; norel:0	arg1-as-detail	conjunction;arg1-as-detail;result	arg1-as-detail	What then must we do? Why, work night and day, body and soul, for the overthrow of the human race!	That is my message to you, comrades: Rebellion! I do not know when that Rebellion will come, it might be in a week or in a hundred years, but I know, as surely as I see this straw beneath my feet, that sooner or later justice will be done.	Why, work night and day, body and soul, for the overthrow of the human race!	That is my message to you, comrades: Rebellion!
Animal_Farm_EN_batch_01_item_13	Animal_Farm_EN_paragraph_03	novel	NA	English	NA	NA	10	0.4	synchronous:0.1; precedence:0.1; succession:0; reason:0; result:0.2; arg1-as-cond:0; arg2-as-cond:0; arg1-as-negcond:0; arg2-as-negcond:0; arg1-as-goal:0; arg2-as-goal:0; arg1-as-denier:0; arg2-as-denier:0; contrast:0; similarity:0; conjunction:0.2; disjunction:0; arg1-as-instance:0; arg2-as-instance:0; arg1-as-detail:0; arg2-as-detail:0.4; equivalence:0; arg1-as-manner:0; arg2-as-manner:0; arg1-as-excpt:0; arg2-as-excpt:0; arg2-as-subst:0; arg1-as-subst:0; differentcon:0; norel:0	arg2-as-detail	conjunction;result;arg2-as-detail	arg2-as-detail	Why, work night and day, body and soul, for the overthrow of the human race! That is my message to you, comrades: Rebellion!	I do not know when that Rebellion will come, it might be in a week or in a hundred years, but I know, as surely as I see this straw beneath my feet, that sooner or later justice will be done. Fix your eyes on that, comrades, throughout the short remainder of your lives!	That is my message to you, comrades: Rebellion!	I do not know when that Rebellion will come, it might be in a week or in a hundred years, but I know, as surely as I see this straw beneath my feet, that sooner or later justice will be done.
Animal_Farm_EN_batch_01_item_14	Animal_Farm_EN_paragraph_04	novel	NA	English	NA	NA	10	0.4	synchronous:0; precedence:0; succession:0; reason:0; result:0; arg1-as-cond:0; arg2-as-cond:0; arg1-as-negcond:0; arg2-as-negcond:0; arg1-as-goal:0; arg2-as-goal:0; arg1-as-denier:0.2; arg2-as-denier:0.1; contrast:0.1; similarity:0; conjunction:0.4; disjunction:0; arg1-as-instance:0; arg2-as-instance:0; arg1-as-detail:0; arg2-as-detail:0.2; equivalence:0; arg1-as-manner:0; arg2-as-manner:0; arg1-as-excpt:0; arg2-as-excpt:0; arg2-as-subst:0; arg1-as-subst:0; differentcon:0; norel:0	conjunction	conjunction;arg1-as-denier;arg2-as-detail	conjunction	There were only four dissentients, the three dogs and the cat, who was afterwards discovered to have voted on both sides. Major continued:      \"I have little more to say.	I merely repeat, remember always your duty of enmity towards Man and all his ways. Whatever goes upon two legs is an enemy.	\"Major continued: \"\"I have little more to say.\"	I merely repeat, remember always your duty of enmity towards Man and all his ways.
Animal_Farm_EN_batch_01_item_15	Animal_Farm_EN_paragraph_04	novel	NA	English	NA	NA	10	0.4	synchronous:0; precedence:0; succession:0; reason:0.1; result:0; arg1-as-cond:0; arg2-as-cond:0; arg1-as-negcond:0; arg2-as-negcond:0; arg1-as-goal:0; arg2-as-goal:0; arg1-as-denier:0; arg2-as-denier:0; contrast:0; similarity:0; conjunction:0.4; disjunction:0; arg1-as-instance:0.1; arg2-as-instance:0; arg1-as-detail:0.1; arg2-as-detail:0.2; equivalence:0.1; arg1-as-manner:0; arg2-as-manner:0; arg1-as-excpt:0; arg2-as-excpt:0; arg2-as-subst:0; arg1-as-subst:0; differentcon:0; norel:0	conjunction	conjunction;arg2-as-detail	conjunction	Major continued:      \"I have little more to say. I merely repeat, remember always your duty of enmity towards Man and all his ways.	Whatever goes upon two legs is an enemy. Whatever goes upon four legs, or has wings, is a friend.	I merely repeat, remember always your duty of enmity towards Man and all his ways.	Whatever goes upon two legs is an enemy.
Animal_Farm_EN_batch_01_item_16	Animal_Farm_EN_paragraph_04	novel	NA	English	NA	NA	10	1	synchronous:0; precedence:0; succession:0; reason:0; result:0; arg1-as-cond:0; arg2-as-cond:0; arg1-as-negcond:0; arg2-as-negcond:0; arg1-as-goal:0; arg2-as-goal:0; arg1-as-denier:0; arg2-as-denier:0; contrast:1.0; similarity:0; conjunction:0; disjunction:0; arg1-as-instance:0; arg2-as-instance:0; arg1-as-detail:0; arg2-as-detail:0; equivalence:0; arg1-as-manner:0; arg2-as-manner:0; arg1-as-excpt:0; arg2-as-excpt:0; arg2-as-subst:0; arg1-as-subst:0; differentcon:0; norel:0	contrast	contrast	contrast	I merely repeat, remember always your duty of enmity towards Man and all his ways. Whatever goes upon two legs is an enemy.	Whatever goes upon four legs, or has wings, is a friend. And remember also that in fighting against Man, we must not come to resemble him.	Whatever goes upon two legs is an enemy.	Whatever goes upon four legs, or has wings, is a friend.
Animal_Farm_EN_batch_01_item_17	Animal_Farm_EN_paragraph_04	novel	NA	English	NA	NA	10	0.5	synchronous:0; precedence:0; succession:0.2; reason:0; result:0; arg1-as-cond:0; arg2-as-cond:0; arg1-as-negcond:0; arg2-as-negcond:0; arg1-as-goal:0; arg2-as-goal:0; arg1-as-denier:0; arg2-as-denier:0; contrast:0; similarity:0; conjunction:0.5; disjunction:0; arg1-as-instance:0; arg2-as-instance:0; arg1-as-detail:0.1; arg2-as-detail:0.1; equivalence:0.1; arg1-as-manner:0; arg2-as-manner:0; arg1-as-excpt:0; arg2-as-excpt:0; arg2-as-subst:0; arg1-as-subst:0; differentcon:0; norel:0	conjunction	succession;conjunction	conjunction	Whatever goes upon four legs, or has wings, is a friend. And remember also that in fighting against Man, we must not come to resemble him.	Even when you have conquered him, do not adopt his vices. No animal must ever live in a house, or sleep in a bed, or wear clothes, or drink alcohol, or smoke tobacco, or touch money, or engage in trade.	And remember also that in fighting against Man, we must not come to resemble him.	Even when you have conquered him, do not adopt his vices.
Animal_Farm_EN_batch_01_item_18	Animal_Farm_EN_paragraph_04	novel	NA	English	NA	NA	10	0.4	synchronous:0; precedence:0; succession:0; reason:0; result:0.1; arg1-as-cond:0; arg2-as-cond:0; arg1-as-negcond:0; arg2-as-negcond:0; arg1-as-goal:0; arg2-as-goal:0.1; arg1-as-denier:0.1; arg2-as-denier:0; contrast:0; similarity:0; conjunction:0.4; disjunction:0; arg1-as-instance:0; arg2-as-instance:0.1; arg1-as-detail:0; arg2-as-detail:0.2; equivalence:0; arg1-as-manner:0; arg2-as-manner:0; arg1-as-excpt:0; arg2-as-excpt:0; arg2-as-subst:0; arg1-as-subst:0; differentcon:0; norel:0	conjunction	arg2-as-detail;conjunction	conjunction	And remember also that in fighting against Man, we must not come to resemble him. Even when you have conquered him, do not adopt his vices.	No animal must ever live in a house, or sleep in a bed, or wear clothes, or drink alcohol, or smoke tobacco, or touch money, or engage in trade. All the habits of Man are evil.	Even when you have conquered him, do not adopt his vices.	No animal must ever live in a house, or sleep in a bed, or wear clothes, or drink alcohol, or smoke tobacco, or touch money, or engage in trade.
Animal_Farm_EN_batch_01_item_19	Animal_Farm_EN_paragraph_05	novel	NA	English	NA	NA	10	0.3	synchronous:0; precedence:0; succession:0; reason:0.2; result:0; arg1-as-cond:0; arg2-as-cond:0; arg1-as-negcond:0; arg2-as-negcond:0; arg1-as-goal:0; arg2-as-goal:0; arg1-as-denier:0; arg2-as-denier:0.3; contrast:0; similarity:0; conjunction:0.2; disjunction:0; arg1-as-instance:0; arg2-as-instance:0; arg1-as-detail:0; arg2-as-detail:0.3; equivalence:0; arg1-as-manner:0; arg2-as-manner:0; arg1-as-excpt:0; arg2-as-excpt:0; arg2-as-subst:0; arg1-as-subst:0; differentcon:0; norel:0	arg2-as-detail	arg2-as-denier;conjunction;reason;arg2-as-detail	arg2-as-detail	And now, comrades, I will tell you about my dream of last night. I cannot describe that dream to you.	It was a dream of the earth as it will be when Man has vanished. But it reminded me of something that I had long forgotten.	I cannot describe that dream to you.	It was a dream of the earth as it will be when Man has vanished.
Animal_Farm_EN_batch_01_item_20	Animal_Farm_EN_paragraph_05	novel	NA	English	NA	NA	11	0.3636363636	synchronous:0; precedence:0; succession:0; reason:0.09090909090909091; result:0; arg1-as-cond:0; arg2-as-cond:0; arg1-as-negcond:0; arg2-as-negcond:0; arg1-as-goal:0; arg2-as-goal:0; arg1-as-denier:0; arg2-as-denier:0; contrast:0; similarity:0; conjunction:0.36363636363636365; disjunction:0; arg1-as-instance:0; arg2-as-instance:0.2727272727272727; arg1-as-detail:0; arg2-as-detail:0.2727272727272727; equivalence:0; arg1-as-manner:0; arg2-as-manner:0; arg1-as-excpt:0; arg2-as-excpt:0; arg2-as-subst:0; arg1-as-subst:0; differentcon:0; norel:0	conjunction	arg2-as-instance;arg2-as-detail;conjunction	conjunction	It was a dream of the earth as it will be when Man has vanished. But it reminded me of something that I had long forgotten.	Many years ago, when I was a little pig, my mother and the other sows used to sing an old song of which they knew only the tune and the first three words. I had known that tune in my infancy, but it had long since passed out of my mind.	But it reminded me of something that I had long forgotten.	Many years ago, when I was a little pig, my mother and the other sows used to sing an old song of which they knew only the tune and the first three words.
