The_Great_Gatsby_EN_batch_02_item_11	The_Great_Gatsby_EN_paragraph_17	novel	NA	English	NA	NA	10	0.5	synchronous:0; precedence:0; succession:0; reason:0; result:0; arg1-as-cond:0.1; arg2-as-cond:0; arg1-as-negcond:0; arg2-as-negcond:0; arg1-as-goal:0; arg2-as-goal:0; arg1-as-denier:0; arg2-as-denier:0; contrast:0.1; similarity:0; conjunction:0.5; disjunction:0; arg1-as-instance:0; arg2-as-instance:0; arg1-as-detail:0; arg2-as-detail:0.3; equivalence:0; arg1-as-manner:0; arg2-as-manner:0; arg1-as-excpt:0; arg2-as-excpt:0; arg2-as-subst:0; arg1-as-subst:0; differentcon:0; norel:0	conjunction	arg2-as-detail;conjunction	conjunction	The apartment was on the top floor  a small living- room, a small dining- room, a small bedroom, and a bath. The living- room was crowded to the doors with a set of tapestried furniture entirely too large for it, so that to move about was to stumble continually over scenes of ladies swinging in the gardens of Versailles.	The only picture was an over- enlarged photograph, apparently a hen sitting on a blurred rock. Looked at from a distance, however, the hen resolved itself into a bonnet, and the countenance of a stout old lady beamed down into the room.	The living- room was crowded to the doors with a set of tapestried furniture entirely too large for it, so that to move about was to stumble continually over scenes of ladies swinging in the gardens of Versailles.	The only picture was an over- enlarged photograph, apparently a hen sitting on a blurred rock.
The_Great_Gatsby_EN_batch_02_item_12	The_Great_Gatsby_EN_paragraph_17	novel	NA	English	NA	NA	10	0.5	synchronous:0.1; precedence:0; succession:0; reason:0; result:0; arg1-as-cond:0; arg2-as-cond:0; arg1-as-negcond:0; arg2-as-negcond:0; arg1-as-goal:0; arg2-as-goal:0; arg1-as-denier:0.1; arg2-as-denier:0; contrast:0.1; similarity:0; conjunction:0.5; disjunction:0; arg1-as-instance:0; arg2-as-instance:0; arg1-as-detail:0; arg2-as-detail:0.1; equivalence:0; arg1-as-manner:0; arg2-as-manner:0; arg1-as-excpt:0; arg2-as-excpt:0; arg2-as-subst:0; arg1-as-subst:0; differentcon:0; norel:0.1	conjunction	conjunction	conjunction	The only picture was an over- enlarged photograph, apparently a hen sitting on a blurred rock. Looked at from a distance, however, the hen resolved itself into a bonnet, and the countenance of a stout old lady beamed down into the room.	Several old copies of Town Tattle lay on the table together with a copy of Simon Called Peter, and some of the small scandal magazines of Broadway. Mrs. Wilson was first concerned with the dog. A reluctant elevator boy went for a box full of straw and some milk, to which he added on his own initiative a tin of large, hard dog biscuits  one of which decomposed apathetically in the saucer of milk all afternoon. Meanwhile Tom brought out a bottle of whisky from a locked bureau door.	Looked at from a distance, however, the hen resolved itself into a bonnet, and the countenance of a stout old lady beamed down into the room.	Several old copies of Town Tattle lay on the table together with a copy of Simon Called Peter, and some of the small scandal magazines of Broadway.
The_Great_Gatsby_EN_batch_02_item_13	The_Great_Gatsby_EN_paragraph_17	novel	NA	English	NA	NA	10	0.3	synchronous:0.1; precedence:0.2; succession:0.1; reason:0; result:0.1; arg1-as-cond:0; arg2-as-cond:0; arg1-as-negcond:0; arg2-as-negcond:0; arg1-as-goal:0; arg2-as-goal:0; arg1-as-denier:0; arg2-as-denier:0; contrast:0.1; similarity:0; conjunction:0.3; disjunction:0; arg1-as-instance:0; arg2-as-instance:0; arg1-as-detail:0; arg2-as-detail:0.1; equivalence:0; arg1-as-manner:0; arg2-as-manner:0; arg1-as-excpt:0; arg2-as-excpt:0; arg2-as-subst:0; arg1-as-subst:0; differentcon:0; norel:0	conjunction	precedence;conjunction	conjunction	Mrs. Wilson was first concerned with the dog. A reluctant elevator boy went for a box full of straw and some milk, to which he added on his own initiative a tin of large, hard dog biscuits  one of which decomposed apathetically in the saucer of milk all afternoon. Meanwhile Tom brought out a bottle of whisky from a locked bureau door. I have been drunk just twice in my life, and the second time was that afternoon; so everything that happened has a dim, hazy cast over it, although until after eight oclock the apartment was full of cheerful sun.	Sitting on Toms lap Mrs. Wilson called up several people on the telephone; then there were no cigarettes, and I went out to buy some at the drugstore on the corner. When I came back they had both disappeared, so I sat down discreetly in the living- room and read a chapter of Simon Called Peter  either it was terrible stuff or the whisky distorted things, because it didnt make any sense to me.	I have been drunk just twice in my life, and the second time was that afternoon; so everything that happened has a dim, hazy cast over it, although until after eight oclock the apartment was full of cheerful sun.	Sitting on Toms lap Mrs. Wilson called up several people on the telephone; then there were no cigarettes, and I went out to buy some at the drugstore on the corner.
The_Great_Gatsby_EN_batch_02_item_14	The_Great_Gatsby_EN_paragraph_18	novel	NA	English	NA	NA	10	0.6	synchronous:0.1; precedence:0; succession:0; reason:0; result:0; arg1-as-cond:0; arg2-as-cond:0; arg1-as-negcond:0; arg2-as-negcond:0; arg1-as-goal:0; arg2-as-goal:0; arg1-as-denier:0; arg2-as-denier:0; contrast:0.3; similarity:0; conjunction:0.6; disjunction:0; arg1-as-instance:0; arg2-as-instance:0; arg1-as-detail:0; arg2-as-detail:0; equivalence:0; arg1-as-manner:0; arg2-as-manner:0; arg1-as-excpt:0; arg2-as-excpt:0; arg2-as-subst:0; arg1-as-subst:0; differentcon:0; norel:0	conjunction	conjunction;contrast	conjunction	But when I asked her she laughed immoderately, repeated my question aloud, and told me she lived with a girl friend at a hotel. Mr. McKee was a pale, feminine man from the flat below. He had just shaved, for there was a white spot of lather on his cheekbone, and he was most respectful in his greeting to everyone in the room. He informed me that he was in the  artistic game, and I gathered later that he was a photographer and had made the dim enlargement of Mrs. Wilsons mother which hovered like an ectoplasm on the wall.	His wife was shrill, languid, handsome, and horrible. She told me with pride that her husband had photographed her a hundred and twenty- seven times since they had been married.	He informed me that he was in the  artistic game, and I gathered later that he was a photographer and had made the dim enlargement of Mrs. Wilsons mother which hovered like an ectoplasm on the wall.	His wife was shrill, languid, handsome, and horrible.
The_Great_Gatsby_EN_batch_02_item_15	The_Great_Gatsby_EN_paragraph_18	novel	NA	English	NA	NA	10	0.6	synchronous:0; precedence:0.2; succession:0; reason:0.1; result:0.6; arg1-as-cond:0; arg2-as-cond:0; arg1-as-negcond:0; arg2-as-negcond:0; arg1-as-goal:0; arg2-as-goal:0; arg1-as-denier:0; arg2-as-denier:0; contrast:0; similarity:0; conjunction:0; disjunction:0; arg1-as-instance:0; arg2-as-instance:0; arg1-as-detail:0.1; arg2-as-detail:0; equivalence:0; arg1-as-manner:0; arg2-as-manner:0; arg1-as-excpt:0; arg2-as-excpt:0; arg2-as-subst:0; arg1-as-subst:0; differentcon:0; norel:0	result	result;precedence	result	She told me with pride that her husband had photographed her a hundred and twenty- seven times since they had been married. Mrs. Wilson had changed her costume some time before, and was now attired in an elaborate afternoon dress of cream- coloured chiffon, which gave out a continual rustle as she swept about the room.	With the influence of the dress her personality had also undergone a change. The intense vitality that had been so remarkable in the garage was converted into impressive hauteur.	Mrs. Wilson had changed her costume some time before, and was now attired in an elaborate afternoon dress of cream- coloured chiffon, which gave out a continual rustle as she swept about the room.	With the influence of the dress her personality had also undergone a change.
The_Great_Gatsby_EN_batch_02_item_16	The_Great_Gatsby_EN_paragraph_18	novel	NA	English	NA	NA	10	0.3	synchronous:0; precedence:0; succession:0; reason:0; result:0.2; arg1-as-cond:0; arg2-as-cond:0; arg1-as-negcond:0; arg2-as-negcond:0; arg1-as-goal:0; arg2-as-goal:0; arg1-as-denier:0; arg2-as-denier:0; contrast:0; similarity:0; conjunction:0.3; disjunction:0.1; arg1-as-instance:0; arg2-as-instance:0.3; arg1-as-detail:0; arg2-as-detail:0.1; equivalence:0; arg1-as-manner:0; arg2-as-manner:0; arg1-as-excpt:0; arg2-as-excpt:0; arg2-as-subst:0; arg1-as-subst:0; differentcon:0; norel:0	conjunction	result;conjunction;arg2-as-instance	conjunction	Mrs. Wilson had changed her costume some time before, and was now attired in an elaborate afternoon dress of cream- coloured chiffon, which gave out a continual rustle as she swept about the room. With the influence of the dress her personality had also undergone a change.	The intense vitality that had been so remarkable in the garage was converted into impressive hauteur. Her laughter, her gestures, her assertions became more violently affected moment by moment, and as she expanded the room grew smaller around her, until she seemed to be revolving on a noisy, creaking pivot through the smoky air.	With the influence of the dress her personality had also undergone a change.	The intense vitality that had been so remarkable in the garage was converted into impressive hauteur.
The_Great_Gatsby_EN_batch_02_item_17	The_Great_Gatsby_EN_paragraph_18	novel	NA	English	NA	NA	10	0.7	synchronous:0; precedence:0; succession:0; reason:0.7; result:0; arg1-as-cond:0; arg2-as-cond:0.1; arg1-as-negcond:0; arg2-as-negcond:0; arg1-as-goal:0; arg2-as-goal:0.1; arg1-as-denier:0; arg2-as-denier:0; contrast:0; similarity:0; conjunction:0; disjunction:0; arg1-as-instance:0; arg2-as-instance:0; arg1-as-detail:0; arg2-as-detail:0.1; equivalence:0; arg1-as-manner:0; arg2-as-manner:0; arg1-as-excpt:0; arg2-as-excpt:0; arg2-as-subst:0; arg1-as-subst:0; differentcon:0; norel:0	reason	reason	reason	Her laughter, her gestures, her assertions became more violently affected moment by moment, and as she expanded the room grew smaller around her, until she seemed to be revolving on a noisy, creaking pivot through the smoky air.  My dear, she told her sister in a high, mincing shout,  most of these fellas will cheat you every time.	All they think of is money. I had a woman up here last week to look at my feet, and when she gave me the bill you d of thought she had my appendicitis out. 	 My dear, she told her sister in a high, mincing shout,  most of these fellas will cheat you every time.	All they think of is money.
The_Great_Gatsby_EN_batch_02_item_18	The_Great_Gatsby_EN_paragraph_21	novel	NA	English	NA	NA	10	0.5	synchronous:0; precedence:0; succession:0; reason:0; result:0.2; arg1-as-cond:0; arg2-as-cond:0; arg1-as-negcond:0; arg2-as-negcond:0; arg1-as-goal:0; arg2-as-goal:0; arg1-as-denier:0; arg2-as-denier:0; contrast:0; similarity:0; conjunction:0.1; disjunction:0; arg1-as-instance:0; arg2-as-instance:0; arg1-as-detail:0; arg2-as-detail:0.5; equivalence:0; arg1-as-manner:0; arg2-as-manner:0.2; arg1-as-excpt:0; arg2-as-excpt:0; arg2-as-subst:0; arg1-as-subst:0; differentcon:0; norel:0	arg2-as-detail	arg2-as-manner;arg2-as-detail;result	arg2-as-detail	 Stay long?   No, we just went to Monte Carlo and back.	We went by way of Marseilles. We had over twelve hundred dollars when we started, but we got gyped out of it all in two days in the private rooms.	  No, we just went to Monte Carlo and back.	We went by way of Marseilles.
The_Great_Gatsby_EN_batch_02_item_19	The_Great_Gatsby_EN_paragraph_21	novel	NA	English	NA	NA	10	0.5	synchronous:0.1; precedence:0.1; succession:0; reason:0.1; result:0.1; arg1-as-cond:0; arg2-as-cond:0; arg1-as-negcond:0; arg2-as-negcond:0; arg1-as-goal:0; arg2-as-goal:0; arg1-as-denier:0; arg2-as-denier:0; contrast:0; similarity:0; conjunction:0.5; disjunction:0; arg1-as-instance:0; arg2-as-instance:0; arg1-as-detail:0; arg2-as-detail:0.1; equivalence:0; arg1-as-manner:0; arg2-as-manner:0; arg1-as-excpt:0; arg2-as-excpt:0; arg2-as-subst:0; arg1-as-subst:0; differentcon:0; norel:0	conjunction	conjunction	conjunction	 No, we just went to Monte Carlo and back. We went by way of Marseilles.	We had over twelve hundred dollars when we started, but we got gyped out of it all in two days in the private rooms. We had an awful time getting back, I can tell you.	We went by way of Marseilles.	We had over twelve hundred dollars when we started, but we got gyped out of it all in two days in the private rooms.
The_Great_Gatsby_EN_batch_02_item_20	The_Great_Gatsby_EN_paragraph_21	novel	NA	English	NA	NA	10	0.6	synchronous:0; precedence:0.1; succession:0; reason:0; result:0.6; arg1-as-cond:0; arg2-as-cond:0; arg1-as-negcond:0; arg2-as-negcond:0; arg1-as-goal:0; arg2-as-goal:0; arg1-as-denier:0; arg2-as-denier:0; contrast:0; similarity:0; conjunction:0.2; disjunction:0; arg1-as-instance:0; arg2-as-instance:0; arg1-as-detail:0.1; arg2-as-detail:0; equivalence:0; arg1-as-manner:0; arg2-as-manner:0; arg1-as-excpt:0; arg2-as-excpt:0; arg2-as-subst:0; arg1-as-subst:0; differentcon:0; norel:0	result	result;conjunction	result	We went by way of Marseilles. We had over twelve hundred dollars when we started, but we got gyped out of it all in two days in the private rooms.	We had an awful time getting back, I can tell you. God, how I hated that town ! 	We had over twelve hundred dollars when we started, but we got gyped out of it all in two days in the private rooms.	We had an awful time getting back, I can tell you.
The_Great_Gatsby_EN_batch_03_item_01	The_Great_Gatsby_EN_paragraph_21	novel	NA	English	NA	NA	10	0.4	synchronous:0; precedence:0; succession:0; reason:0; result:0; arg1-as-cond:0; arg2-as-cond:0; arg1-as-negcond:0; arg2-as-negcond:0; arg1-as-goal:0; arg2-as-goal:0; arg1-as-denier:0.4; arg2-as-denier:0.2; contrast:0.3; similarity:0; conjunction:0.1; disjunction:0; arg1-as-instance:0; arg2-as-instance:0; arg1-as-detail:0; arg2-as-detail:0; equivalence:0; arg1-as-manner:0; arg2-as-manner:0; arg1-as-excpt:0; arg2-as-excpt:0; arg2-as-subst:0; arg1-as-subst:0; differentcon:0; norel:0	arg1-as-denier	arg1-as-denier;contrast;arg2-as-denier	arg1-as-denier	 I almost made a mistake, too, she declared vigorously.  I almost married a little kike who d been after me for years.	I knew he was below me. Everybody kept saying to me :  Lucille, that mans way below you ! 	 I almost married a little kike who d been after me for years.	I knew he was below me.
The_Great_Gatsby_EN_batch_03_item_02	The_Great_Gatsby_EN_paragraph_23	novel	NA	English	NA	NA	10	0.3	synchronous:0.2; precedence:0.1; succession:0; reason:0.2; result:0; arg1-as-cond:0; arg2-as-cond:0; arg1-as-negcond:0; arg2-as-negcond:0; arg1-as-goal:0; arg2-as-goal:0; arg1-as-denier:0; arg2-as-denier:0; contrast:0; similarity:0; conjunction:0.3; disjunction:0; arg1-as-instance:0; arg2-as-instance:0; arg1-as-detail:0; arg2-as-detail:0.2; equivalence:0; arg1-as-manner:0; arg2-as-manner:0; arg1-as-excpt:0; arg2-as-excpt:0; arg2-as-subst:0; arg1-as-subst:0; differentcon:0; norel:0	conjunction	arg2-as-detail;conjunction;synchronous;reason	conjunction	When we came into the station he was next to me, and his white shirtfront pressed against my arm, and so I told him I d have to call a policeman, but he knew I lied. I was so excited that when I got into a taxi with him I didnt hardly know I wasnt getting into a subway train.	All I kept thinking about, over and over, was  You cant live forever; you cant live forever.  	I was so excited that when I got into a taxi with him I didnt hardly know I wasnt getting into a subway train.	All I kept thinking about, over and over, was  You cant live forever; you cant live forever.
The_Great_Gatsby_EN_batch_03_item_03	The_Great_Gatsby_EN_paragraph_23	novel	NA	English	NA	NA	10	0.8	synchronous:0; precedence:0; succession:0; reason:0; result:0; arg1-as-cond:0; arg2-as-cond:0; arg1-as-negcond:0; arg2-as-negcond:0; arg1-as-goal:0; arg2-as-goal:0; arg1-as-denier:0; arg2-as-denier:0; contrast:0; similarity:0.1; conjunction:0.8; disjunction:0; arg1-as-instance:0; arg2-as-instance:0; arg1-as-detail:0; arg2-as-detail:0.1; equivalence:0; arg1-as-manner:0; arg2-as-manner:0; arg1-as-excpt:0; arg2-as-excpt:0; arg2-as-subst:0; arg1-as-subst:0; differentcon:0; norel:0	conjunction	conjunction	conjunction	 My dear, she cried,  Im going to give you this dress as soon as Im through with it. I ve got to get another one tomorrow.	Im going to make a list of all the things I ve got to get. A massage and a wave, and a collar for the dog, and one of those cute little ashtrays where you touch a spring, and a wreath with a black silk bow for mothers grave that ll last all summer.	I ve got to get another one tomorrow.	Im going to make a list of all the things I ve got to get.
The_Great_Gatsby_EN_batch_03_item_04	The_Great_Gatsby_EN_paragraph_23	novel	NA	English	NA	NA	11	0.3636363636	synchronous:0.36363636363636365; precedence:0.2727272727272727; succession:0; reason:0; result:0.09090909090909091; arg1-as-cond:0; arg2-as-cond:0; arg1-as-negcond:0; arg2-as-negcond:0; arg1-as-goal:0; arg2-as-goal:0; arg1-as-denier:0; arg2-as-denier:0; contrast:0; similarity:0.09090909090909091; conjunction:0.18181818181818182; disjunction:0; arg1-as-instance:0; arg2-as-instance:0; arg1-as-detail:0; arg2-as-detail:0; equivalence:0; arg1-as-manner:0; arg2-as-manner:0; arg1-as-excpt:0; arg2-as-excpt:0; arg2-as-subst:0; arg1-as-subst:0; differentcon:0; norel:0	synchronous	synchronous;precedence	synchronous	I got to write down a list so I wont forget all the things I got to do.  It was nine oclock  almost immediately afterward I looked at my watch and found it was ten.	Mr. McKee was asleep on a chair with his fists clenched in his lap, like a photograph of a man of action. Taking out my handkerchief I wiped from his cheek the spot of dried lather that had worried me all the afternoon.	 It was nine oclock  almost immediately afterward I looked at my watch and found it was ten.	Mr. McKee was asleep on a chair with his fists clenched in his lap, like a photograph of a man of action.
The_Great_Gatsby_EN_batch_03_item_05	The_Great_Gatsby_EN_paragraph_23	novel	NA	English	NA	NA	9	0.5555555556	synchronous:0.5555555555555556; precedence:0; succession:0; reason:0; result:0; arg1-as-cond:0; arg2-as-cond:0; arg1-as-negcond:0; arg2-as-negcond:0; arg1-as-goal:0; arg2-as-goal:0; arg1-as-denier:0; arg2-as-denier:0; contrast:0.1111111111111111; similarity:0; conjunction:0.3333333333333333; disjunction:0; arg1-as-instance:0; arg2-as-instance:0; arg1-as-detail:0; arg2-as-detail:0; equivalence:0; arg1-as-manner:0; arg2-as-manner:0; arg1-as-excpt:0; arg2-as-excpt:0; arg2-as-subst:0; arg1-as-subst:0; differentcon:0; norel:0	synchronous	conjunction;synchronous	synchronous	Taking out my handkerchief I wiped from his cheek the spot of dried lather that had worried me all the afternoon. The little dog was sitting on the table looking with blind eyes through the smoke, and from time to time groaning faintly.	People disappeared, reappeared, made plans to go somewhere, and then lost each other, searched for each other, found each other a few feet away. Some time toward midnight Tom Buchanan and Mrs. Wilson stood face to face discussing, in impassioned voices, whether Mrs. Wilson had any right to mention Daisys name.	The little dog was sitting on the table looking with blind eyes through the smoke, and from time to time groaning faintly.	People disappeared, reappeared, made plans to go somewhere, and then lost each other, searched for each other, found each other a few feet away.
The_Great_Gatsby_EN_batch_03_item_06	The_Great_Gatsby_EN_paragraph_24	novel	NA	English	NA	NA	10	0.4	synchronous:0; precedence:0.3; succession:0.1; reason:0; result:0; arg1-as-cond:0; arg2-as-cond:0; arg1-as-negcond:0; arg2-as-negcond:0; arg1-as-goal:0; arg2-as-goal:0; arg1-as-denier:0; arg2-as-denier:0; contrast:0.1; similarity:0; conjunction:0.1; disjunction:0; arg1-as-instance:0; arg2-as-instance:0; arg1-as-detail:0; arg2-as-detail:0.4; equivalence:0; arg1-as-manner:0; arg2-as-manner:0; arg1-as-excpt:0; arg2-as-excpt:0; arg2-as-subst:0; arg1-as-subst:0; differentcon:0; norel:0	arg2-as-detail	arg2-as-detail;precedence	arg2-as-detail	III There was music from my neighbours house through the summer nights. In his blue gardens men and girls came and went like moths among the whisperings and the champagne and the stars.	At high tide in the afternoon I watched his guests diving from the tower of his raft, or taking the sun on the hot sand of his beach while his two motorboats slit the waters of the Sound, drawing aquaplanes over cataracts of foam. On weekends his Rolls- Royce became an omnibus, bearing parties to and from the city between nine in the morning and long past midnight, while his station wagon scampered like a brisk yellow bug to meet all trains.	In his blue gardens men and girls came and went like moths among the whisperings and the champagne and the stars.	At high tide in the afternoon I watched his guests diving from the tower of his raft, or taking the sun on the hot sand of his beach while his two motorboats slit the waters of the Sound, drawing aquaplanes over cataracts of foam.
The_Great_Gatsby_EN_batch_03_item_07	The_Great_Gatsby_EN_paragraph_24	novel	NA	English	NA	NA	10	0.4	synchronous:0.2; precedence:0; succession:0; reason:0; result:0; arg1-as-cond:0; arg2-as-cond:0; arg1-as-negcond:0; arg2-as-negcond:0; arg1-as-goal:0.1; arg2-as-goal:0; arg1-as-denier:0; arg2-as-denier:0; contrast:0.2; similarity:0; conjunction:0.4; disjunction:0; arg1-as-instance:0; arg2-as-instance:0; arg1-as-detail:0; arg2-as-detail:0.1; equivalence:0; arg1-as-manner:0; arg2-as-manner:0; arg1-as-excpt:0; arg2-as-excpt:0; arg2-as-subst:0; arg1-as-subst:0; differentcon:0; norel:0	conjunction	contrast;conjunction;synchronous	conjunction	In his blue gardens men and girls came and went like moths among the whisperings and the champagne and the stars. At high tide in the afternoon I watched his guests diving from the tower of his raft, or taking the sun on the hot sand of his beach while his two motorboats slit the waters of the Sound, drawing aquaplanes over cataracts of foam.	On weekends his Rolls- Royce became an omnibus, bearing parties to and from the city between nine in the morning and long past midnight, while his station wagon scampered like a brisk yellow bug to meet all trains. And on Mondays eight servants, including an extra gardener, toiled all day with mops and scrubbing- brushes and hammers and garden- shears, repairing the ravages of the night before.	At high tide in the afternoon I watched his guests diving from the tower of his raft, or taking the sun on the hot sand of his beach while his two motorboats slit the waters of the Sound, drawing aquaplanes over cataracts of foam.	On weekends his Rolls- Royce became an omnibus, bearing parties to and from the city between nine in the morning and long past midnight, while his station wagon scampered like a brisk yellow bug to meet all trains.
The_Great_Gatsby_EN_batch_03_item_08	The_Great_Gatsby_EN_paragraph_24	novel	NA	English	NA	NA	10	0.5	synchronous:0; precedence:0; succession:0; reason:0; result:0.2; arg1-as-cond:0; arg2-as-cond:0; arg1-as-negcond:0; arg2-as-negcond:0; arg1-as-goal:0; arg2-as-goal:0; arg1-as-denier:0; arg2-as-denier:0; contrast:0; similarity:0; conjunction:0.5; disjunction:0; arg1-as-instance:0; arg2-as-instance:0; arg1-as-detail:0; arg2-as-detail:0.3; equivalence:0; arg1-as-manner:0; arg2-as-manner:0; arg1-as-excpt:0; arg2-as-excpt:0; arg2-as-subst:0; arg1-as-subst:0; differentcon:0; norel:0	conjunction	arg2-as-detail;result;conjunction	conjunction	There was a machine in the kitchen which could extract the juice of two hundred oranges in half an hour if a little button was pressed two hundred times by a butlers thumb. At least once a fortnight a corps of caterers came down with several hundred feet of canvas and enough coloured lights to make a Christmas tree of Gatsbys enormous garden.	On buffet tables, garnished with glistening hors- doeuvre, spiced baked hams crowded against salads of harlequin designs and pastry pigs and turkeys bewitched to a dark gold. In the main hall a bar with a real brass rail was set up, and stocked with gins and liquors and with cordials so long forgotten that most of his female guests were too young to know one from another.	At least once a fortnight a corps of caterers came down with several hundred feet of canvas and enough coloured lights to make a Christmas tree of Gatsbys enormous garden.	On buffet tables, garnished with glistening hors- doeuvre, spiced baked hams crowded against salads of harlequin designs and pastry pigs and turkeys bewitched to a dark gold.
